{
  "test_id": "EC-004",
  "requirement_ref": {
    "source": "DOC",
    "locator": "input/feature-ecommerce/requirement.md#r-4--product-grid--display",
    "quote": "An actionable \"Add to Cart\" button. ... A dedicated shopping cart icon to display or navigate to user selections."
  },

  "feature": "Add to Cart",
  "module": "ProductGrid",
  "capability": "ProductGrid.AddToCart",
  "priority": "P0",
  "role": "Guest",
  "environment": "STAGE",

  "auth": { "strategy": "anonymous" },

  "starting_context": { "page": "home", "location": "All Products grid", "url_hint": "/" },

  "preconditions": [
    "STAGE is reachable and the home page loads with the full product catalog",
    "\"Wireless Headphones\" is currently the first product card in catalog order — this mission targets the first Add to Cart button by position, not by product identity, because there is no per-card locator (e.g. a data-testid) to target the product directly. If the catalog is reordered, this mission will act on whatever product is first, and A1 will correctly fail rather than silently pass, since it checks for the specific title.",
    "No confirmation UI (badge/toast) is assumed after clicking Add to Cart — this was an open gap (G-3) resolved by verifying success on the Cart page instead, per human decision at Gate 1 analysis review"
  ],

  "test_objective": "Verify that adding a product to the cart makes it appear on the Cart page.",
  "expected_outcome": "succeeds",

  "data_policy": {
    "creates_artifacts": true,
    "cleanup": "none",
    "cleanup_instruction": "No naming_pattern is set — this mission adds an existing catalog item to a cart session rather than creating a new named record (contrast with WorkPod's SM-001, which creates a named entity). The cart is assumed to be session-scoped and ephemeral for an anonymous Guest; this is an assumption, not a confirmed fact (see gap G-3/G-4 in the analysis)."
  },

  "actions": [
    { "action": "navigate", "instruction": "Open the home page.", "url": "/" },
    {
      "action": "click",
      "instruction": "Add the first product in the grid (expected: Wireless Headphones) to the cart.",
      "target": {
        "description": "First 'Add to Cart' button in the product grid, targeted by position since no per-card identifier exists",
        "role": "button",
        "name": "Add to Cart",
        "expect_multiple": true,
        "nth": 0
      }
    },
    {
      "action": "click",
      "instruction": "Open the Cart via the top navigation.",
      "target": {
        "description": "Cart link, scoped to the top nav (the footer's Quick Links repeats the same link text)",
        "role": "link",
        "name": "Cart",
        "within": { "description": "top navigation bar", "role": "navigation" }
      }
    },
    { "action": "wait_for_state", "instruction": "Wait for the Cart page to settle.", "state": "networkidle" }
  ],

  "assertions": [
    {
      "id": "A1",
      "statement": "\"Wireless Headphones\" is visible on the Cart page.",
      "check": { "type": "visible", "target": { "description": "Wireless Headphones line item on the Cart page", "text": "Wireless Headphones" } },
      "critical": true
    },
    {
      "id": "A2",
      "statement": "The Cart page URL is reached.",
      "check": { "type": "url_contains", "value": "/cart" },
      "critical": true
    }
  ],

  "evidence_policy": {
    "screenshot": "on_failure",
    "trace": "retain_on_failure",
    "console": true,
    "network": false,
    "snapshot_on_failure": true
  },

  "budget": { "max_steps": 10, "timeout_ms": 60000, "action_timeout_ms": 15000, "max_discovery_attempts": 3 },

  "rerun_policy": { "replay_on_failure": true, "on_divergence": "INCONCLUSIVE" }
}
