{
  "test_id": "SM-002",
  "requirement_ref": {
    "source": "DOC",
    "locator": "input/feature/requirement.md",
    "quote": "The top-left brand logo fails to load properly, displaying a broken image placeholder icon in the browser viewport.",
    "content_hash": "sha256:2f4a3b02b9e13b375cec84f00278283e"
  },
  "feature": "Global Navigation",
  "module": "Navigation",
  "capability": "Navigation.BrandLogo",
  "priority": "P0",
  "role": "guest",
  "environment": "STAGE",
  "auth": {
    "strategy": "anonymous"
  },
  "starting_context": {
    "page": "Home",
    "location": "Top Navigation Bar"
  },
  "preconditions": [
    "Application is loaded at the home page"
  ],
  "test_objective": "Verify the brand logo image loads and renders correctly in the top navigation bar.",
  "expected_outcome": "succeeds",
  "actions": [
    {
      "action": "navigate",
      "instruction": "Go to the home page.",
      "url": "/"
    }
  ],
  "assertions": [
    {
      "id": "A1",
      "statement": "The brand logo image is visible and rendered (not a broken image placeholder).",
      "check": {
        "type": "visible",
        "target": {
          "description": "Brand logo image in top-left of navigation bar",
          "role": "img",
          "name": "logo"
        }
      }
    }
  ],
  "evidence_policy": {
    "screenshot": "on_failure",
    "trace": "retain_on_failure",
    "console": true,
    "network": true,
    "snapshot_on_failure": true
  },
  "budget": {
    "max_steps": 5,
    "timeout_ms": 30000,
    "action_timeout_ms": 10000
  },
  "data_policy": {
    "creates_artifacts": false
  },
  "approval": {
    "approved_by": "Jay",
    "approved_at": "2026-09-12T10:53:52.703Z",
    "edits_made": false,
    "review_minutes": 5
  }
}
