{
  "test_id": "SM-001",
  "requirement_ref": {
    "source": "DOC",
    "locator": "input/feature/requirement.md",
    "quote": "The primary navigation link for the home page is misspelled as \"Hoem\" instead of \"Home\".",
    "content_hash": "sha256:2f4a3b02b9e13b375cec84f00278283e"
  },
  "feature": "Global Navigation",
  "module": "Navigation",
  "capability": "Navigation.HomeLink",
  "priority": "P0",
  "role": "guest",
  "environment": "STAGE",
  "auth": {
    "strategy": "anonymous"
  },
  "starting_context": {
    "page": "Home",
    "location": "Top Navigation Bar"
  },
  "preconditions": [
    "Application is loaded at the home page"
  ],
  "test_objective": "Verify the top navigation Home link displays the correct spelling 'Home'.",
  "expected_outcome": "succeeds",
  "actions": [
    {
      "action": "navigate",
      "instruction": "Go to the home page.",
      "url": "/"
    }
  ],
  "assertions": [
    {
      "id": "A1",
      "statement": "The top navigation link reads 'Home', not 'Hoem'.",
      "check": {
        "type": "text_equals",
        "target": {
          "description": "Home navigation link in top nav bar",
          "role": "link",
          "name": "Home"
        },
        "value": "Home"
      }
    }
  ],
  "evidence_policy": {
    "screenshot": "on_failure",
    "trace": "retain_on_failure",
    "console": false,
    "network": false,
    "snapshot_on_failure": true
  },
  "budget": {
    "max_steps": 5,
    "timeout_ms": 30000,
    "action_timeout_ms": 10000
  },
  "data_policy": {
    "creates_artifacts": false
  },
  "approval": {
    "approved_by": "Jay",
    "approved_at": "2026-09-12T10:53:51.184Z",
    "edits_made": false,
    "review_minutes": 5
  },
  "coverage": {
    "category": "ui_ux",
    "execution_mode": "automated"
  }
}
