{
  "test_id": "SM-003",
  "requirement_ref": {
    "source": "DOC",
    "locator": "input/feature/requirement.md",
    "quote": "In the brief description above the Quick Links, the word \"purpose\" is misspelled as \"perpose\".",
    "content_hash": "sha256:2f4a3b02b9e13b375cec84f00278283e"
  },
  "feature": "Global Footer",
  "module": "Footer",
  "capability": "Footer.PlatformDescription",
  "priority": "P1",
  "role": "guest",
  "environment": "STAGE",
  "auth": {
    "strategy": "anonymous"
  },
  "starting_context": {
    "page": "Home",
    "location": "Footer"
  },
  "preconditions": [
    "Application is loaded at the home page"
  ],
  "test_objective": "Verify the footer platform description spells 'purpose' correctly.",
  "expected_outcome": "succeeds",
  "actions": [
    {
      "action": "navigate",
      "instruction": "Go to the home page and scroll to the footer.",
      "url": "/"
    }
  ],
  "assertions": [
    {
      "id": "A1",
      "statement": "The footer description text contains the correctly spelled word 'purpose', not 'perpose'.",
      "check": {
        "type": "text_contains",
        "target": {
          "description": "Footer platform description paragraph above Quick Links",
          "role": "contentinfo",
          "text": "purpose"
        },
        "value": "purpose"
      }
    }
  ],
  "evidence_policy": {
    "screenshot": "on_failure",
    "trace": "retain_on_failure",
    "console": false,
    "network": false,
    "snapshot_on_failure": true
  },
  "budget": {
    "max_steps": 5,
    "timeout_ms": 30000,
    "action_timeout_ms": 10000
  },
  "data_policy": {
    "creates_artifacts": false
  },
  "approval": {
    "approved_by": "Jay",
    "approved_at": "2026-09-12T10:53:54.346Z",
    "edits_made": false,
    "review_minutes": 5
  },
  "coverage": {
    "category": "ui_ux",
    "execution_mode": "automated"
  }
}
