{
  "test_id": "SM-005",
  "requirement_ref": {
    "source": "DOC",
    "locator": "input/feature/requirement.md",
    "quote": "The navigation menu contains an empty bracket set [] next to the Checkout link in the raw text structure, which likely correlates to a missing or improperly labeled accessibility tag for the Cart icon.",
    "content_hash": "sha256:2f4a3b02b9e13b375cec84f00278283e"
  },
  "feature": "Global Navigation",
  "module": "Navigation",
  "capability": "Navigation.CartIcon",
  "priority": "P0",
  "role": "guest",
  "environment": "STAGE",
  "auth": {
    "strategy": "anonymous"
  },
  "starting_context": {
    "page": "Home",
    "location": "Top Navigation Bar"
  },
  "preconditions": [
    "Application is loaded at the home page"
  ],
  "test_objective": "Verify the cart icon in the navigation bar has a proper accessible name.",
  "expected_outcome": "succeeds",
  "actions": [
    {
      "action": "navigate",
      "instruction": "Go to the home page.",
      "url": "/"
    }
  ],
  "assertions": [
    {
      "id": "A1",
      "statement": "The cart icon element exposes a non-empty accessible name (e.g. 'Cart').",
      "check": {
        "type": "attribute_equals",
        "target": {
          "description": "Shopping cart icon in top navigation bar",
          "role": "link",
          "name": "Cart"
        },
        "attribute": "aria-label",
        "value": "Cart"
      }
    }
  ],
  "evidence_policy": {
    "screenshot": "on_failure",
    "trace": "retain_on_failure",
    "console": false,
    "network": false,
    "snapshot_on_failure": true
  },
  "budget": {
    "max_steps": 5,
    "timeout_ms": 30000,
    "action_timeout_ms": 10000
  },
  "data_policy": {
    "creates_artifacts": false
  },
  "approval": {
    "approved_by": "Jay",
    "approved_at": "2026-09-12T10:53:56.610Z",
    "edits_made": false,
    "review_minutes": 5
  },
  "coverage": {
    "category": "ui_ux",
    "execution_mode": "automated"
  }
}
