{
  "test_id": "EC-006",
  "requirement_ref": {
    "source": "DOC",
    "locator": "input/feature-ecommerce/requirement.md#r-4--product-grid--display",
    "quote": "Product Image ... An actionable \"Add to Cart\" button. A dedicated shopping cart icon to display or navigate to user selections.",
    "content_hash": "sha256:d93f44e1b0b4bfbdddc722d0c87757eb"
  },
  "feature": "Page integrity sweep",
  "module": "ProductGrid",
  "capability": "ProductGrid.Display",
  "priority": "P0",
  "role": "Guest",
  "environment": "STAGE",
  "auth": {
    "strategy": "anonymous"
  },
  "starting_context": {
    "page": "home",
    "location": "whole page",
    "url_hint": "/"
  },
  "preconditions": [
    "STAGE is reachable and the home page loads",
    "Lazy-loaded images below the fold may not have loaded yet. The sweep reports those as unverified rather than failing them, so scroll position cannot produce a phantom failure."
  ],
  "test_objective": "Verify every image on the home page actually loads.",
  "expected_outcome": "succeeds",
  "data_policy": {
    "creates_artifacts": false
  },
  "actions": [
    {
      "action": "navigate",
      "instruction": "Open the home page.",
      "url": "/"
    },
    {
      "action": "wait_for_state",
      "instruction": "Wait for images to finish loading.",
      "state": "networkidle"
    }
  ],
  "assertions": [
    {
      "id": "A1",
      "statement": "Every visible image on the home page loads successfully (no broken-image placeholders).",
      "check": {
        "type": "all_images_loaded",
        "value": 0
      },
      "critical": true
    }
  ],
  "evidence_policy": {
    "screenshot": "on_failure",
    "trace": "retain_on_failure",
    "console": true,
    "network": false,
    "snapshot_on_failure": true
  },
  "budget": {
    "max_steps": 6,
    "timeout_ms": 60000,
    "action_timeout_ms": 20000,
    "max_discovery_attempts": 3
  },
  "rerun_policy": {
    "replay_on_failure": true,
    "on_divergence": "INCONCLUSIVE"
  },
  "approval": {
    "approved_by": "jay.r",
    "approved_at": "2026-09-12T11:36:19.979Z",
    "edits_made": false,
    "review_minutes": 2
  },
  "coverage": {
    "category": "ui_ux",
    "execution_mode": "automated"
  }
}
